{
  "accounts": {
    "deploy": "compromised",
    "root": "misused"
  },
  "attack_techniques": [
    "T1110.001 Password Guessing",
    "T1078 Valid Accounts",
    "T1059.006 Command and Scripting Interpreter: Python",
    "T1105 Ingress Tool Transfer",
    "T1059.004 Unix Shell",
    "T1548.003 Sudo and Sudo Caching",
    "T1053.005 Scheduled Task/Job: Scheduled Task",
    "T1095 Non-Application Layer Protocol"
  ],
  "classification": "malicious",
  "hosts": {
    "10.10.10.15": "affected",
    "web01": "compromised"
  },
  "incident_id": "incident01",
  "incident_occurred": true,
  "network_indicators": {
    "185.199.110.47": "malicious",
    "192.0.2.55": "suspicious",
    "198.51.100.24": "suspicious",
    "203.0.113.77": "suspicious"
  },
  "schema_version": "1.0",
  "severity": "high"
}
