{
  "accounts": {
    "admin": "attempted",
    "deploy": "compromised",
    "root": "compromised"
  },
  "attack_techniques": [
    "T1110 - Brute Force",
    "T1078 - Valid Accounts",
    "T1548.003 - Sudo and Sudo Caching",
    "T1105 - Ingress Tool Transfer",
    "T1059 - Command and Scripting Interpreter",
    "T1095 - Non-Application Layer Protocol"
  ],
  "classification": "malicious",
  "hosts": {
    "web01": "compromised"
  },
  "incident_id": "incident01",
  "incident_occurred": true,
  "network_indicators": {
    "185.199.110.47": "malicious",
    "192.0.2.55": "malicious",
    "198.51.100.24": "suspicious",
    "203.0.113.77": "malicious",
    "cdn-assets.examplecdn.net": "suspicious",
    "unknown-service.example.net": "malicious",
    "updates.examplecdn.net": "malicious"
  },
  "schema_version": "1.0",
  "severity": "high"
}
